[
  {
    "kpi": "credit_realized_losses_q2_25_usd",
    "claim": "Realized losses on loans sold $7.2 million",
    "value": 7200000,
    "unit": "USD",
    "asof": "2025-06-30",
    "status": "C",
    "url": "<EDGAR直URL>"
  },
  {
    "kpi": "revolver_capacity_q2_25_usd",
    "claim": "Revolving credit facility total capacity $500.0 million",
    "value": 500000000,
    "unit": "USD",
    "asof": "2025-06-30",
    "status": "C",
    "url": "<EDGAR直URL>"
  },
  {
    "kpi": "loan_purchases_q2_25_usd",
    "claim": "Loan purchases totaled $288.4 million",
    "value": 288435000,
    "unit": "USD",
    "asof": "2025-06-30",
    "status": "C",
    "url": "<EDGAR直URL>"
  },
  {
    "kpi": "loans_fv_q2_25_usd",
    "claim": "Loans held for sale at fair value $1.020 billion",
    "value": 1020000000,
    "unit": "USD",
    "asof": "2025-06-30",
    "status": "C",
    "url": "<EDGAR直URL>"
  },
  {
    "kpi": "nonaccrual_rate_q2_25_pct",
    "claim": "Nonaccrual loans 2.3% of total loans",
    "value": 2.3,
    "unit": "percent",
    "asof": "2025-06-30",
    "status": "C",
    "url": "<EDGAR直URL>"
  },
  {
    "kpi": "ust_2025_3_executed_terms",
    "claim": "ABS-15G filed with Ex.99.1 (AUP)",
    "status": "W",
    "asof": "2025-09-02",
    "ttl_days": 14,
    "trigger_if_false": "No 10-D/8-K/424B by TTL",
    "note": "ABS-15G(AUP)のみ。総額/クラス別/クロージングはEDGAR未出"
  },
  {
    "kpi": "forward_flow_fortress_agreement",
    "claim": "Forward-flow agreement with Fortress (unconfirmed)",
    "status": "W",
    "asof": "2025-09-02",
    "ttl_days": 7,
    "trigger_if_false": "8-K/Ex-10.xx未出",
    "note": "一次未確証（official_source_unconfirmed）"
  }
]
